{
  "compare": {
    "ahead_by": 101,
    "commit_shas": [
      "99c9be1d30ea78fad24d9eca8daa3526592a77b5",
      "8030c3697019b32dd0fc2b232cea0c2c2574fe9d",
      "a2a9e767f7fc5c4fa9dc6c91c6907612dda72cf3",
      "52b359b24913ddab5d12d42f2f113b0e63843063",
      "2d5c264ebc26c276ca6cc312389abde453ca69aa",
      "10b408080a1009ca99be50cf8bc3fe45dfe7223b",
      "aeac226d16523875a3fc77f61d6edcd2943155fc",
      "57ab4c89e05d13b81722780ffc50eee0ea6cf445",
      "a2ebe07b39823945aaedd4e1acbd70316ca13f1d",
      "d8121f93c8df2e9066e929128886cae2fc81782b",
      "0eb7e6d79b44b95d4aa6b22759322efcccde3521",
      "2ca3810005f61bb033ccf6c48111e2aa4536b0e4",
      "11bceb8f8bfdd8723da10bdcaa767a19d92a2a57",
      "4231472c03e6c6e3374b1c19ef096ee28476f9dd",
      "14272b21e95ed9a54fae21c27d33d3771a9ee30f",
      "0ed2735d195d149766b242d972f95f3173ebc984",
      "4d4837c4951375c877986e239304c95ebbe14633",
      "8285cd278babadc98458194fb2dbc3ae7f00429c",
      "80b65e99457344f5f05fb4948eb35c6b1d320e3f",
      "6bcccb0ee6b875a41ed9e8fb7e299a6b98dd3faa",
      "c143a86de8c5da3ae5127565b9ffe7094d2e5c28",
      "ad2012d645b7146d31bb03f98e2bd9371635d11a",
      "16d02ec77c6337ccea02a8c909e05bf3d905f887",
      "d297616d3e6a27865fb327e7b4ea3d548f7fdb45",
      "d46a98d31a9c32949580e6e3ce65b85772f3470d",
      "7da4af622ffc68d7b687e61ba8f19163af50fab8",
      "d81fcdf8ef3f2857db1a51b83a012638a7ecf0fb",
      "4ae7930f58c980c1064f5c2f7a2e38b1058e0410",
      "68db0bb5ec67635d3052ddae2ecb35cdea48263e",
      "12e8764a9c61dfc8cc8ba2520a2b7cf3e0500edd",
      "cbf62f64cbfdca160e7303536ec6ea464d371281",
      "cdc1d592df7f066c141025cc8ae80bb3202580b6",
      "881cf191d72da0edfc90cbc9fd5b3c30cb6eb9bc",
      "c8fdc74b421fb904e11c07886a3a7dc22fa56ed6",
      "9e41f8ddbe087ae6b9bdfb8d5821ab2f09f8c5fe",
      "8b1238856b0839cfdb345ee2af9f02e4ee2959f9",
      "c3fcb0e7457dc53aa4422ae4356e1fcc2a206ce6",
      "e64b469bbcf2c2a6bb575ef0a58368f02147e899",
      "555f8caeff42073fcdc52755491d785adcc81e4a",
      "f97d5c327538a8fe8580fa4dd9ee22c213780a59",
      "d312a53e2a4419c339c890b79f02b56c19abac85",
      "4a70e0ac1b39c6da6863069bebc82ce3513bc8b5",
      "8ac304c2997529d3b6fe4be4ba032e0f2dac16af",
      "f6e529656f7ce4af6d146f4b0c8500a6d89221c2",
      "37c8aefa14e1a8bb817ee63ddc4561da04741082",
      "59ca34206b4606a8800a4e565d6006f02fa37206",
      "769c231aa1d69e2482fda2a51444d7f7a2158e3a",
      "e695ec8ec612f61f6150299cc5c0ec39138dc902",
      "b9ff4509029b40a0c10964aa751a1a006ab46359",
      "0b2e7b5eb1cfa74e5807a84b291e6c900eeb197d",
      "72d0bfb6ba4b59ad78fbe012052a06a2c0874fc3",
      "4be1a168fc7ed3313ddc62031da036f0c50209b7",
      "ecae41274091252f454eb5ed0507036ed4e6fc19",
      "e0096db6dc8a2f89394986123802a676a1be20c5",
      "4de7a2b9d8eae19e00ca7f744647fa1aabdc204f",
      "1d9c9c9f33735223cc564ec942001c9141a11eb1",
      "a2f5874b7a2db79b46c60a73858ba4c4b4807c05",
      "64e0829cab9dccb14b8273a2ebea2eee9e06c12c",
      "6a6a5f925e97bee23d5d31938b5f9f9f38becb8a",
      "5f4d06ef186b896d316620556e561d59206c3ebf",
      "6dc28ba6e0acd391a1a006af8bd0237b61fd54a6",
      "55aa071b17c825bdb66fac99cde2e7a7acfbdee7",
      "66232220e21712604b0066f496e966c9a2c1bda8",
      "0b1512c2c83935af4eaa096ac7e434992f15b066",
      "5e62c735b2b261e897276b4df544a197c49081d4",
      "a14a73b54af26af4a5428ba2eb482a1ce54f8974",
      "3acd71fedb1284e0f27f400e2d354a942b273421",
      "e781816eadf1986c6ccb382b34a8d5bb4c23fb70",
      "fb0993dd3b68315408eaa109924c63f434e85382",
      "e5af672d730aa2a11c5e0ca5bc933f8c5195317a",
      "d5e4f01af4f7d3937ee4cd54ac27507fa421d755",
      "40c8f1a0072e04f2df049c2233a28543604fc448",
      "d40454522e2c6216eeeca5d97d39e991791ec664",
      "9ddb1de633bde6d3d3e9b8012f822eb447db5195",
      "da490ba9de80bf83ad04f8db4cf72b793e99967f",
      "86a1ddd0282f83f21d2e5743ffd1d6ba36725ed1",
      "841f057f2d2647441cfd3fa586f3f5d06f89d599",
      "0177231ca055955bd553ac5f57d59f5df9639dd4",
      "78eba34b4148ec14493684ffc3a866415cbbbbd1",
      "a8c95309111f1bb8b4864102a306d7e60a729ad0",
      "713192381b74f09f4b92f3ed410da067461d5cd0",
      "679a944dbcdd5de1e745172268eb9e050d0d6034",
      "82b15b65e2303255e3e1a740d994c7e00250344a",
      "8d72fb6de92bf332b2ef4a4ccaf992021fbdf4ea",
      "76c0a5379c79cc6eafc3a041791201e849ad4c7f",
      "345cf6e8d06b0d6890e68dc5fd80227f2fbb4e71",
      "055c7a7c53d46517e95f24147980b4523da279db",
      "bb7d19bc245b9661fbf2391a2d02d9d9139c4fee",
      "679cc084451e2111ad946d0befe583b79e486ca9",
      "479a14cf592d5e0ca319942e6ba833ebaa1274e2",
      "470c20bf98ce35c8bcaa021e722f0a7074c4530b",
      "c62d79259d0ccd83ad515d3444840e0e0e18059a",
      "4f655bc3b740bb1fec3744df4851f7eb1b95fbe9",
      "ffe90cb5c37d4cf6ccfa9de0126a5ff61cb959e5",
      "61a913d9c83928335b9503ad530caa9851bf5955",
      "df7818c7d138ad081f5bd1fa584646c116da7022",
      "954e2878bbd735839c13a5e4e7bd45c74648f549",
      "2f108f9fd970ed73df7e984d3a661acc02f33abc",
      "cbac22dabec0dd043c670b54de397a3be5fc0133",
      "3ea9e983334ce187b295359d19b17706b7dd1144",
      "8404d0e0036b1626f97bbdac808a98323cc0b261"
    ],
    "pr_numbers": [
      23710,
      24852,
      25000,
      25344,
      25469,
      25623,
      25638,
      25700,
      25710,
      25731,
      25887,
      25925,
      25936,
      25944,
      25945,
      25946,
      25947,
      25955,
      25960,
      26002,
      26013,
      26047,
      26074,
      26075,
      26147,
      26172,
      26175,
      26179,
      26181,
      26189,
      26205,
      26210,
      26215,
      26216,
      26226,
      26248,
      26251,
      26252,
      26254,
      26256,
      26260,
      26265,
      26272,
      26291,
      26307,
      26312,
      26313,
      26317,
      26320,
      26335,
      26367,
      26396,
      26417,
      26431,
      26433,
      26435,
      26436,
      26444,
      26445,
      26446,
      26447,
      26449,
      26450,
      26453,
      26457,
      26462,
      26465,
      26466,
      26469,
      26471,
      26473,
      26480,
      26482,
      26484,
      26487,
      26490,
      26499,
      26500,
      26532,
      26537,
      26538,
      26542,
      26547,
      26548,
      26551,
      26552,
      26553,
      26554,
      26566,
      26599,
      26610,
      26623,
      26625,
      26631,
      26636,
      26669,
      26674,
      26690,
      26698,
      26716
    ],
    "status": "diverged",
    "total_commits": 101,
    "url": "https://github.com/openai/codex/compare/rust-v0.137.0...rust-v0.138.0-alpha.6"
  },
  "comparisons": [
    {
      "compare": {
        "ahead_by": 101,
        "commit_shas": [
          "99c9be1d30ea78fad24d9eca8daa3526592a77b5",
          "8030c3697019b32dd0fc2b232cea0c2c2574fe9d",
          "a2a9e767f7fc5c4fa9dc6c91c6907612dda72cf3",
          "52b359b24913ddab5d12d42f2f113b0e63843063",
          "2d5c264ebc26c276ca6cc312389abde453ca69aa",
          "10b408080a1009ca99be50cf8bc3fe45dfe7223b",
          "aeac226d16523875a3fc77f61d6edcd2943155fc",
          "57ab4c89e05d13b81722780ffc50eee0ea6cf445",
          "a2ebe07b39823945aaedd4e1acbd70316ca13f1d",
          "d8121f93c8df2e9066e929128886cae2fc81782b",
          "0eb7e6d79b44b95d4aa6b22759322efcccde3521",
          "2ca3810005f61bb033ccf6c48111e2aa4536b0e4",
          "11bceb8f8bfdd8723da10bdcaa767a19d92a2a57",
          "4231472c03e6c6e3374b1c19ef096ee28476f9dd",
          "14272b21e95ed9a54fae21c27d33d3771a9ee30f",
          "0ed2735d195d149766b242d972f95f3173ebc984",
          "4d4837c4951375c877986e239304c95ebbe14633",
          "8285cd278babadc98458194fb2dbc3ae7f00429c",
          "80b65e99457344f5f05fb4948eb35c6b1d320e3f",
          "6bcccb0ee6b875a41ed9e8fb7e299a6b98dd3faa",
          "c143a86de8c5da3ae5127565b9ffe7094d2e5c28",
          "ad2012d645b7146d31bb03f98e2bd9371635d11a",
          "16d02ec77c6337ccea02a8c909e05bf3d905f887",
          "d297616d3e6a27865fb327e7b4ea3d548f7fdb45",
          "d46a98d31a9c32949580e6e3ce65b85772f3470d",
          "7da4af622ffc68d7b687e61ba8f19163af50fab8",
          "d81fcdf8ef3f2857db1a51b83a012638a7ecf0fb",
          "4ae7930f58c980c1064f5c2f7a2e38b1058e0410",
          "68db0bb5ec67635d3052ddae2ecb35cdea48263e",
          "12e8764a9c61dfc8cc8ba2520a2b7cf3e0500edd",
          "cbf62f64cbfdca160e7303536ec6ea464d371281",
          "cdc1d592df7f066c141025cc8ae80bb3202580b6",
          "881cf191d72da0edfc90cbc9fd5b3c30cb6eb9bc",
          "c8fdc74b421fb904e11c07886a3a7dc22fa56ed6",
          "9e41f8ddbe087ae6b9bdfb8d5821ab2f09f8c5fe",
          "8b1238856b0839cfdb345ee2af9f02e4ee2959f9",
          "c3fcb0e7457dc53aa4422ae4356e1fcc2a206ce6",
          "e64b469bbcf2c2a6bb575ef0a58368f02147e899",
          "555f8caeff42073fcdc52755491d785adcc81e4a",
          "f97d5c327538a8fe8580fa4dd9ee22c213780a59",
          "d312a53e2a4419c339c890b79f02b56c19abac85",
          "4a70e0ac1b39c6da6863069bebc82ce3513bc8b5",
          "8ac304c2997529d3b6fe4be4ba032e0f2dac16af",
          "f6e529656f7ce4af6d146f4b0c8500a6d89221c2",
          "37c8aefa14e1a8bb817ee63ddc4561da04741082",
          "59ca34206b4606a8800a4e565d6006f02fa37206",
          "769c231aa1d69e2482fda2a51444d7f7a2158e3a",
          "e695ec8ec612f61f6150299cc5c0ec39138dc902",
          "b9ff4509029b40a0c10964aa751a1a006ab46359",
          "0b2e7b5eb1cfa74e5807a84b291e6c900eeb197d",
          "72d0bfb6ba4b59ad78fbe012052a06a2c0874fc3",
          "4be1a168fc7ed3313ddc62031da036f0c50209b7",
          "ecae41274091252f454eb5ed0507036ed4e6fc19",
          "e0096db6dc8a2f89394986123802a676a1be20c5",
          "4de7a2b9d8eae19e00ca7f744647fa1aabdc204f",
          "1d9c9c9f33735223cc564ec942001c9141a11eb1",
          "a2f5874b7a2db79b46c60a73858ba4c4b4807c05",
          "64e0829cab9dccb14b8273a2ebea2eee9e06c12c",
          "6a6a5f925e97bee23d5d31938b5f9f9f38becb8a",
          "5f4d06ef186b896d316620556e561d59206c3ebf",
          "6dc28ba6e0acd391a1a006af8bd0237b61fd54a6",